<?xml version="1.0" encoding="UTF-8"?>
<zahtev_za_sertifikat xmlns="http://ftn.uns.ac.rs/vakcina/zahtev"
                      xmlns:xsi="http://www.w3.org/2001/XMLSchema-instance"
                      xmlns:pred="http://www.ftn.uns.ac.rs/rdf/zahtev/predicate/"
                      xsi:schemaLocation="../schemas/zahtev_za_sertifikat.xsd"
                      about="http://www.ftn.uns.ac.rs/rdf/zahtev/123"
                      rel="pred:zahtevOd" href="http://www.ftn.uns.ac.rs/rdf/potvrda/123">
    <licni_podaci>
        <ime_prezime>
            <ime xmlns="http://www.ftn-vakcine.rs/types">Aleksandar</ime>
            <prezime xmlns="http://www.ftn-vakcine.rs/types">Jovanovic</prezime>
        </ime_prezime>
        <datum_rodjenja>1999-08-08</datum_rodjenja>
        <pol>M</pol>
        <JMBG  property="pred:jmbg">0808999742049</JMBG>
        <broj_pasosa>052425937</broj_pasosa>
    </licni_podaci>
    <razlog_za_zahtev>Putovanje</razlog_za_zahtev>
    <mesto prop="pred:mesto">Novi Sad</mesto>
    <datum_zahteva prop="pred:datum">2021-12-03</datum_zahteva>
    <potpis>AJovanoviÄ‡</potpis>
</zahtev_za_sertifikat>