<?xml version="1.0" encoding="UTF-8"?>
<zahtev_za_sertifikat xmlns="http://www.ftn-vakcine/zahtev_sertifikat"
    xmlns:xsi="http://www.w3.org/2001/XMLSchema-instance"
    xsi:schemaLocation="http://www.ftn-vakcine/zahtev_sertifikat ../schemas/zahtev_za_sertifikat.xsd">
    <licni_podaci>
        <ime_prezime>
            <ime xmlns="http://www.ftn-vakcine.rs/types">Aleksandar</ime>
            <prezime xmlns="http://www.ftn-vakcine.rs/types">Jovanovic</prezime>
        </ime_prezime>
        <datum_rodjenja>1999-08-08</datum_rodjenja>
        <pol>M</pol>
        <JMBG>0808999742049</JMBG>
        <broj_pasosa>052425937</broj_pasosa>
    </licni_podaci>
    <razlog_za_zahtev>Putovanje</razlog_za_zahtev>
    <mesto>Novi Sad</mesto>
    <datum_zahteva>2021-12-03</datum_zahteva>
    <potpis>AJovanoviÄ‡</potpis>
</zahtev_za_sertifikat>